nouvelle-calédonie : des émeutes sans fin,Nation,3064
"nouvelle illustration du mépris de l’exécutif pour l’outre-mer : ni darmanin ni la ministre de l’outre-mer présents la semaine dernière en guadeloupe, n’ont cru bon d’écouter les planteurs de canne, piliers de l’économie guadeloupéenne qui font vivre des milliers d’exploitations.",Nation,3215
"ce week-end, au salon des agricultures de provence aux côtés de nos paysans. retenez juste 2 chiffres : 90% des fruits et légumes produits en provence sont exportés et 90% des fruits et légumes consommés en provence sont importés. on marche sur la tête ! vivementle9juin",Nation,3220
". : ""cherche chef désespérément"" selon notre chroniqueur, le monde politique connaît une baisse de niveau. les temps de paix choisissent des hommes que les temps de guerre envoient à la retraite. :link: chronique jdd :",Nation,3295
"les normes européennes sont déjà inadaptées pour nos pêcheurs en europe, elles le sont encore plus ici, à mayotte. c’est exactement la même chose pour les agriculteurs.",Nation,3337
":red_apple::pear: avec l’association nationale des pommes et des poires ce matin au sia2024. comme beaucoup de filières, ils demandent simplement que les mêmes règles sur les pesticides s’appliquent dans l’ensemble des pays de l’ue.",Nation,3342
l’article 6 de cette loa est avant tout cosmétique : :right_arrow: ajout redondant de mentions. :right_arrow: déséquilibre entre intérêts environnementaux et souveraineté alimentaire. :right_arrow: manque d’informations sur les plans pluriannuels de transition. :cross_mark: nous voterons contre cet article. directan,Nation,3365
"oui, c'est vrai ! et philippe de villiers, et quelques autres. globalement les souverainistes ont vu juste sur l'opération covid. mais leur dispersion est telle qu'ils ne font pas une force et finissent pas décourager ceux qui les suivent, et même ceux qui les ont précédé...",Nation,3420
":cross_mark::ballot_box_with_ballot: « un texte qui, en esquivant perpétuellement le fond du problème agricole :france:, échoue lamentablement à tenir son rang de projet de loiagricole ». nous voterons contre ce texte. directan",Nation,3487
:television: michel onfray concernant la situation en nouvelle-calédonie : « c'est une vraie guerre civile [...] des blancs sont terrés chez eux »,Nation,3503
il y a une surchauffe réglementaire aujourd'hui et nos agriculteurs n'en peuvent plus. je suis favorable à une pause réglementaire et à la fin de la stratégie de décroissance agricole. débatbfmtv,Nation,3553
« la france de la ruralité est une france dont on ne parle jamais ! nos agriculteurs sont des gens formidables qui travaillent et qui en veulent ! ce sont des gens intelligents et courageux qui font vivre notre pays. c'est pour cela qu'il faut les soutenir !»,Nation,3564
"après les accords de libre échange avec la nouvelle zélande, l’ue poignarde une nouvelle fois les éleveurs français en exonérant de droits de douane la volaille ukrainienne. qui défend les intérêts des européens face à leur dirigeants ?!",Nation,3579
vous êtes contre l’élargissement ? vous considérez que l’entrée de ces pays va ruiner notre agriculture et créer encore plus de dumping social et environnemental ? alors ne votez pas bellamy !,Nation,3581
"l’agriculture française représente à peine 0,2% des émissions mondiales de gaz à effet de serre. m. le ministre de l'agriculture , arrêtez de les accabler d'objectifs environnementaux inatteignables car ils sont exemplaires et ont déjà fait leur transition !",Nation,3598
":green_circle: un exemple de l’immobilisme du gouvernement face à la détresse des agriculteurs : :right_arrow: en juin 2023, je l’interpelle sur le nouveau nutriscore qui va impacter le pruneau. :right_arrow: 3 mois après, je reçois une réponse d’impuissance. :right_arrow: aujourd’hui, toute une filière est menacée. :right_arrow_curving_down:",Nation,3600
"soutien aux agriculteursencolère. une société qui méprise ceux qui nous nourrissent et qui entretiennent un rapport essentiel à la nature est vouée au chaos. fiers et enracinés, ils sont un modèle de courage. dieu bénisse le labeur des paysans de france !",Nation,3636
"un « poste contre » son « silence »… si l’information est avérée, cela en dit long sur la probité du gouvernement et l’intérêt que porte ce dernier aux agriculteursencolère !",Nation,3638
la chine poursuit ses manœuvres militaires près de taïwan,Nation,3640
:fire: soutien total aux agriculteurs en colère. :tractor: pas de pays sans paysans.,Nation,3649
":tomato: à fauillet chez monsieur faux, propriétaire de l’earl rouge qui produit des tomates sous la marque « les paysans de rougeline » afin d’échanger sur les problématiques de la filière.",Nation,3737
"je travaille depuis des années à un nouvel accord que je comptais proposer au moment du vote du congrès avec toute une série d'évolutions, et avec un référendum dans 40 ans. aujourd'hui, le risque majeur, c'est celui de la guerre civile. il faut trouver des solutions.",Nation,3850
réflexion constituante 1 avec « jack angaräa » (joannes itiaty) de nouvelle-calédonie nouvelle_calédonie,Nation,3873
"nos agriculteurs sont abandonnés et méprisés. l’union européenne sacrifie, via ses normes et accords de libre-échange, la petite exploitation familiale, au nom d'une agriculture agro-industrielle, avec des géants mondiaux. comme le dit françois guillaume, ancien grand ministre",Nation,3874
"les ouvriers ont été liquidés avec maastricht, c'est maintenant au tour des paysans. emmanuel macron a choisi la souveraineté européenne : le pouvoir n'est plus chez nous. le souhait de gabriel attal de restaurer la souveraineté nationale agricole relève donc de",Nation,3885
:red_circle: « notre démocratie mérite mieux que vous » : la charge de ruffin contre lfi :right_arrow_curving_down:,Nation,3936
":television: philippe rio, maire communiste de grigny (91) : si le rn gagne, « il y aura de la résistance et de la désobéissance civile, il y aura certainement quelque chose qui ressemblerait à de l'anarchie. » legislativesanticipées",Nation,3951
"il faut préserver le modèle agricole mahorais, qui est un modèle de petites structures, d’exploitations familiales et de circuits courts. à mayotte, je réitère aux agriculteurs mahorais tout mon soutien. l’état doit se tenir à leurs côtés pour les aider.",Nation,3967
"en nouvellecalédonie , la situation vire à la guerre inter-ethnique sur fond de racisme ant-blanc ! on compte déjà 2 morts et des centaines de blessés dont plus d'une centaine de policiers et gendarmes ! le seul ""appel au calme"" qu'il faut, c'est l'armée !",Nation,3991
"l'auteur de ""the great reset"", marc morano, à propos du projet de klaus schwab pour l'humanité : ""il parle essentiellement de l'abandon de la souveraineté nationale, des libertés individuelles et du transfert du pouvoir à des experts... tout ce programme vise à faire en sorte…",Nation,4007
"nouvelle-calédonie: émeutes sociales, politiques ou raciales ?",Nation,4084
les canadiens français qui vivent au canada anglais sont foutus. qui en doute encore sérieusement? --- jdm,Nation,4108
":united_states: selon reuters, les états-unis ont fomenté une campagne « antivax » aux philippines puis dans d'autres pays pour lutter contre l'influence chinoise et contre son vaccin sinovac. cela se traduisait notamment par une campagne d'influence sur les réseaux sociaux. exemple :right_arrow_curving_down:",Nation,4109
"après le vote du traité commercial avec le chili, la macronie se renie à nouveau, refusant, comme le premier ministre s’y était engagé, à protéger les agriculteurs des importations ukrainiennes. ce pouvoir cultive l’art de rendre impossible ce qui est indispensable pour le pays.",Nation,4138
":sweat_droplets: « une véritable épée de damoclès plane sur les agriculteurs qui voient les projets de rétention d’eau contestés par des associations environnementalistes zélées, bien moins soucieuse de l’écologie que de la destruction de l’agriculture française » ploa",Nation,4204
":cut_of_meat: la consommation française de viande est relativement stable, les importations explosent :chart_increasing:. mais 20% des abattoirs :france: sont menacés de fermeture actuellement. à quand une politique publique pour préserver notre souveraineté alimentaire également par ce biais ? directan",Nation,4222
:tractor: auprès des agriculteursencolère lot-et-garonnais ce matin sur le point de rassemblement de l’autoroute d’agen afin de les assurer de mon plein soutien et écouter leurs revendications.,Nation,4240
"nous voulons qu’au règne du libre-échange succède celui du ""juste échange"" dont la règle est simple: la réciprocité. il s’agit de limiter l’importation sur notre sol de produits qui ne respectent pas les normes qui sont imposées aux entreprises françaises. cpme",Nation,4245
"« la france des agriculteurs, c'est la france qui travaille ! c'est la france du mérite ! ce sont des gens qui ne comptent pas leurs heures afin de réaliser une tâche noble : nourrir les hommes. ils font partie de notre identité. j'ai pour eux un profond respect !»",Nation,4251
bravo ! les agriculteurs n’ont rien à faire au salon de l’agriculture !,Nation,4276
:tomato::cucumber: sur le stand du label zéro résidu de pesticides afin de rencontrer l’association nationale de producteurs de tomates et concombres qui font face notamment à une concurrence déloyale venue du maroc. sia2024,Nation,4288
"a 5 jours du salon de l’agriculture, les agriculteurs maintiennent la pression sur le gouvernement et menacent de reprendre leur mouvement. rdv dès 8h10 pour lagrandeitw avec le président de la fnsea",Nation,4330
":red_circle: dans le loiret, a exposé à nos agriculteurs nos mesures pour les soutenir face à la concurrence internationale déloyale et à la décroissance agricole. parce qu'il n'y a pas de pays sans paysans, les 30 juin et 7 juillet, votez rn ! :france: bardellapremierministre",Nation,4349
"on a perdu 100 000 exploitations agricoles en 10 ans. je défends une exception agriculturelle française, et le patriotisme économique en faveur de nos agriculteurs. débatbfmtv",Nation,4367
en séance de nuit en ⁦⁩ pour la suite de la défense de nos amendements sur le projet de loi d’orientation pour la souveraineté en matière agricole.directan :sheaf_of_rice:,Nation,4369
"mon échange avec emmanuelle latraverse à propos de pierre poilievre, le chef conservateur canadien.",Nation,4373
"derrière les mesurettes annoncées par attal il reste le sujet majeur, irrésolu et constant depuis des décennies : les traités de libre-échange votés au parlement ue qui minent nos agriculteurs en les exposant à une concurrence folle ! nous devons dénoncer ces traités ! et vite !",Nation,4411
:writing_hand_medium-light_skin_tone: l’école rurale doit être une priorité pour les politiques publiques. retrouvez la proposition de résolution que j’ai cosignée à ce sujet. :right_arrow:,Nation,4438
"la hongrie obtient une dérogation et ne financera pas le programme de coordination de l’otan destiné à kiev, annonce le secrétaire général de l'alliance, jens stoltenberg",Nation,4454
:ox: aujourd’hui à villeneuvesurlot pour l’inauguration de la feria agricole et gourmande aux côtés de ma collègue et de . bravo pour cette belle manifestation qui met à l’honneur le monde agricole du lotetgaronne :clapping_hands_light_skin_tone:.,Nation,4473
":red_circle:l'étonnante investiture de raphaël arnault, militant antifa violent, pour le nouveau front populaire :speaking_head: « vu le profil du garçon, très dur, d’extrême gauche, comment va-t-on mobiliser l’électorat modéré du centre-ville ? » le sénateur lucien stanzione.",Nation,4503
":seedling: concurrence déloyale, marge faible pour le producteur, augmentation du coût des énergies : comme beaucoup de secteurs agricoles, la tomate lot-et-garonnaise connaît des difficultés malgré sa filière d’excellence française.",Nation,4506
a midi midinews - agriculteurs souveraineté alimentaire en danger? - colere paysans en route vers paris? - robertmenard :«plus facile de vivre dans le 93 que dans l’aveyron» - deputes 300 euros de + de frais de mandat - immigration l’avis conseilconstitutionnel,Nation,4534
"""j'avais des mesures fortes à présenter le 4 juillet sur l'accès à la culture dans la ruralité"" déclare",Nation,4559
"l’accord signé cette nuit à bruxelles sur les importations agricoles d’ukraine est un vrai méchant coup de poignard dans le dos de nos paysans ! :right_arrow_curving_down: 1. le principe : la poursuite des importations sans droits de douane, comme depuis 2022 : concurrence déloyale insoutenable ! le…",Nation,4608
:loudspeaker: communiqué :loudspeaker: :red_circle: la mairie socialiste du 10ᵉ arrondissement tente d’interdire la cérémonie des bobards d’or ! bobardsdor gauche censure,Nation,4611
"rencontre dans le loiret de avec de nombreux agriculteurs pour évoquer les difficultés qu’ils traversent : normes, rentabilité, concurrence déloyale… super organisation de . tous sommes fiers de nos paysans qui sont la france du travail et de l’excellence",Nation,4653
les agriculteurs ne comprennent pas que l'on fasse venir des produits du bout du monde qui ne respectent pas les normes qu'on leur impose. je demande un moratoire sur les accords de libre-échange pour que nos agriculteurs puissent commercent avec les mêmes règles.,Nation,4662
"ici, en aveyron, mais aussi dans de nombreuses campagnes, les transhumances valorisent notre agriculture et nos racines.",Nation,4773
"tout ce que nous vivons depuis des années, c’est une guerre civile qui nous est menée par un autre peuple et une autre civilisation, qui n’a pas le même rapport à l’individu et à la violence que nous. elle ne connaît que la loi du clan et celle de dieu. incarville",Nation,4814
a midi midinews - agriculteurs: le moment de vérité? attal macron - colereagricole la grande distribution dans le viseur. - europe ursula von der leyen pour un projet de décroissance? - mercosur les revirements d’e. macron - paris ou bruxelles où est le pouvoir?,Nation,4837
"elevages intensifs : 99,87% d’avis citoyens défavorables ; l’etat adopte pourtant ce décret !",Nation,4878
":plus:de liberté, :minus: de contraintes ! afin de simplifier les conditions d’exercice de l’activité agricole, nous proposons de supprimer le caractère obligatoire du dispositif de notification du futur départ en retraite des agriculteurs. loiagricole",Nation,4906
"j’avais prévenu. on est passé des bandes aux gangs et demain, nous passerons des gangs aux maras, milices criminelles. nous y sommes. et elles mèneront la guerre à l’état. la plus grand fermeté s’impose face à cette évolution.",Nation,4913
"l'ue nous empêche par exemple de consommer de la viande française dans les cantines scolaires : je veux que l'on puisse faire du patriotisme économique, que l'on puisse accorder une priorité aux entreprises françaises et européennes dans la commande publique. levenement",Nation,4965
► agriculteurs néerlandais : les damnés de la mondialisation - tribune de clément martin :,Nation,4972
"conversation avec le chef de rayon fruits et légumes de franprix : - je ne vois que des fraises espagnoles, vous n’avez pas de fraises françaises ? - je viens de recevoir ce matin des fraises du maroc, de chez moi. - justement, moi aussi je voudrais des fraises de chez moi, de…",Nation,5064
« les agriculteurs n'en peuvent plus de ce mépris de la part de certains bobos qui s'installent à la campagne tout en prétendant vouloir consommer local mais qui ne supportent pas le chant du coq ou l'odeur du fumier et qui vont jusqu'à les faire condamner au tribunal.»,Nation,5115
":microphone: à l’occasion de la mission agriculture de la seconde partie du plf2024, j’interpellerai monsieur , ministre de l’agriculture au sujet de la grippeaviaire et de ses conséquences sur le monde agricole.",Nation,5155
québécois: vous ne méritez ni le mépris ni les crachats | jdm,Nation,5159
dans la lignée de claude bourguignon je vous présente konrad schreiber sur les rapports entre nouvelles techniques agricoles et écologie.,Nation,5177
"«le gouvernement legault se décompose à vue d'œil», lance robert laplante :",Nation,5269
":collision: violence, haine anti-blanche, (dé)colonisation, autochtones, intérêt stratégique… je vais analyser ce qui se passe en nouvelle-calédonie car il y a beaucoup à dire ! si des personnes qui habitent là-bas sont dispos pour témoigner, faites-moi signe d’ici 13h (22h à nouméa).",Nation,5334
"tous les paysans avaient un couteau (laguiole, opinel) dans la poche qui servait à tout, y compris, très beau geste qui se perd, à « signer » le pain avant de le rompre. pourquoi faudrait-il punir les paysans (et les couteliers) pour les crimes des délinquants ?",Nation,5357
":red_circle: voter pour le front populaire (nupes), c’est voter pour le désarmement de nos forces de l’ordre. :right_arrow_curving_down: frontpopulairedelahonte",Nation,5421
la sca des perrinots est reconnue pour son expertise et son savoir-faire qui lui permettent de produire et de vendre ses fraises « sans résidu de pesticide » à la grande distribution ou en direct depuis la ferme en période estivale. marmande,Nation,5434
:strawberry::kiwi_fruit: ce matin à bourran afin de rencontrer les gérants de l’exploitation agricole « les confiseries du verdier ». cette entreprise familiale produit des confitures et des confiseries avec sa propre production de fruits dont 400 tonnes de fraises et 250 tonnes de kiwis annuelles.,Nation,5453
":red_circle: voter pour le front populaire (nupes), c’est voter pour des responsables politiques qui cautionnent la haine des blancs, des forces de l’ordre et des homosexuels. tous aux urnes ! chaos manifestation frontpopulairedelahonte :right_arrow_curving_down:",Nation,5462
"nous seuls avons défendu l'exception agricole française fragilisée par l'écologie punitive et la concurrence déloyale. patriotisme économique, réciprocité dans les échanges, refus des élargissements de l'ue qui ruineraient notre agriculture : nous agirons. vivementle9juin",Nation,5476
"merci à la chambre d’agriculture de la réunion pour leur invitation, pour la visite de la coopérative et pour nos fructueux échanges. l’union européenne souhaite la mort de l’agriculture française, nous, nous continuerons de la défendre !",Nation,5481
"avec ce tweet ajoute le mensonge à l’indignité. à piétiner ainsi l’assemblee nationale qui pèse déjà bien peu dans une démocratie française bien usée, le gvt se prépare des lendemains très agités dans la rue. conseilconstitutionnel",Nation,5499
voici la vidéo de pierre-guillaume mercadal sauvons les paysans français agriculteurencolere,Nation,5516
« nous sommes pour une europe de la puissance agricole. nous ne pouvons plus d’accabler de normes les agriculteurs tout en les mettant en concurrence avec la terre entière. » je représentais aujourd’hui au débat organisé par la fnsea de nouvelle-aquitaine.,Nation,5596
"vous devriez protéger nos agriculteurs français avant tout! vous ne le faites jamais, l’ukraine serait la première bénéficiaire de la pac, intéressez-vous aux difficultés que connaît la filière avicole de notre pays par exemple!",Nation,5602
":green_circle: non, ce sont des propositions concrètes du : :right_arrow: moratoire sur les accords de libre échange et exception agriculturelle :right_arrow: sobriété normative et fin de l’écologie punitive :right_arrow: une loi « mangeons français :france: » :right_arrow: exonération des droits de successions sia2024",Nation,5632
"""ils disent on est violents mais si on les attrape on va leur faire manger le sol""",Nation,5688
"derrière la manifestation pro-hamas du carrefour laval, un refus du québec | jdm",Nation,5719
"philippe poutou candidat à trèbes où a été tué le colonel arnaud beltrame : ""je ne comprends pas. la population est indignée. nous sommes sous le choc"", la colère du maire grandmatin",Nation,5756
"""touche pas à mon paysan !"" le choix de darmanin de mobiliser des blindés face aux tracteurs fait craindre un possible affrontement face aux agriculteursencolere. derrière eux, c’est tout un système technocratique producteur de planifications, de normes et de surveillances…",Nation,5820
:blue_circle: : afin de protéger nos agriculteurs et notre souveraineté alimentaire : :right_arrow: mise place d’une exception agriculturelle :right_arrow: pause réglementaire européenne :right_arrow: création d’une loi « mangeons français :france: » legrandjury,Nation,5859
"l’importation de bœuf nourri aux farines animales, c’est grâce à l’europe ! la concurrence déloyale, c’est grâce à l’europe ! le saccage de l’agriculture française par le pacte vert, c’est grâce à l’europe !",Nation,5915
". : ""l'extrême droite, c'est comme le canada dry""",Nation,5952
"les produits alimentaires étiquetés avec le drapeau français devraient obligatoirement contenir des aliments produits en france. or, ce n'est pas toujours le cas car le gouvernement n'applique pas ce principe de bon sens et continue de porter préjudice aux agriculteurs français.",Nation,5977
":tractor: tenue par mes obligations de vice-présidente de l’assemblée nationale, je dois me rendre à paris ce matin. je soutiens pleinement le mouvement de nos agriculteurs du lotetgaronne qui se mobilisent aujourd’hui pour leur survie. une prise de conscience doit avoir lieu !",Nation,5995
"oui, le peuple québécois peut disparaître | jdm",Nation,6021
"pour stopper le mouvement des agriculteursencolère, le gouvernement a changé radicalement de discours : moins de contraintes et de taxes, circuits courts et souveraineté alimentaire… suite à cette opération de communication, les agriculteurs attendent des réponses concrètes. :right_arrow_curving_down:",Nation,6039
":blue_circle: vraiment ? il y a un mois, cette demande était qualifiée de « proposition démagogique » par votre ministre de l'agriculture. face à nos propositions, la réponse est toujours la même avec marc fesneau…",Nation,6049
"nouvelle-calédonie : tous les quartiers de nouméa sont désormais ""sous contrôle"", annonce le ministre de l'intérieur",Nation,6050
retrouvez-moi ce samedi 24 février sur de 17h00 à 19h00. punchlinewe spéciale salonagriculture :farmer::tractor::sheaf_of_rice:,Nation,6060
"ne demandez pas ce que chacun dit dans cette campagne, mais ce que chacun a fait pendant le mandat passé. le projet ""farm to fork"" a été porté par une majorité allant de l'extrême-gauche aux élus macronistes. c'est nous qui nous y sommes opposés. ledebat debatbfm avecbellamy",Nation,6160
वाराणसी के फूलपुर थाना क्षेत्र के श्रमिक भुख मरी के कगार पर।कारखाना मालिक के तानाशाह के वजह से।जुलाई 2015 से लेकर अब तक नही मिला एक भी बेतन।,Nation,6166
emmanuel pradère au jdd : « le jardinage est une passion très française en plein développement »,Nation,6179
"j’apporte tout mon soutien à nos compatriotes de nouvelle-calédonie subissant agressions, pillages et incendies. jamais aucune opposition politique ne devrait pouvoir se livrer à un tel déchaînement de violence, aucune cause ne saurait la justifier.",Nation,6209
"pour qualifier la révolte ethnique canaque en cours en nouvelle-calédonie, le président utilise des mots inadéquats",Nation,6214
":green_circle: contrairement aux écologistes auteurs de cette proposition de loi, je refuse de faire peser le prix de la transition agroécologique sur les entreprises agro-alimentaires françaises :france:. mes amendements. :right_arrow_curving_down: directan",Nation,6265
"crise agricole, l'union européenne bouc émissaire ou vraie coupable ? le débat / à voir ici :",Nation,6281
on peut affirmer sans se tromper que le québec serait une société occidentale normale. je peine à voir pourquoi et comment on peut imaginer le contraire.,Nation,6291
les agriculteursencolère ne sont pas dupes et ont réagi très durement à l’accord européen décidé cette nuit sur les importations de produits agricoles ukrainiens : ils ont raison ! :right_arrow_curving_down: on va vous dire dans les médias que des importations ukrainiennes « sont plafonnées » : c’est…,Nation,6321
:red_circle: le front populaire (nupes) c’est : être député et jouer avec un ballon de foot à l’effigie d’un ministre. :right_arrow_curving_down: frontpopulairedelahonte,Nation,6381
":red_circle: : ""c'est désolant le nombre de trahison en politique ! il ne se passe plus rien à gaza ? on ne dit plus rien à gauche ! à droite, ciotti rejoint le rn pour sauver sa circonscription, et marion méréchal, après s'es mise au chaud, trahit zemmour !""",Nation,6398
":tractor: lors du plf2024, avec mes collègues du , nous présenterons un amendement visant à supprimer l’augmentation des taxes sur le gnr :fuel_pump:. face à cette hausse des coûts pour les agriculteurs, préservons notre agriculture et le pouvoir d’achat des français. :right_arrow_curving_down: directan",Nation,6407
