"la réponse de macron aux agriculteursencolere contre l' : ""nous voulons une europe plus forte"", avec un ""egalim européen"", une relance de la pac, une force européenne de contrôle sanitaire, etc. le retour promis à une souveraineté nationale attendra.",Nation,6450
"si vous produisez en france avec des salariés français, vous devez avoir une priorité d'accès dans les marchés publics. je souhaite par exemple que nos agriculteurs aient une priorité d'accès aux marchés publics pour qu'on puisse manger français dans nos cantines.",Nation,6457
":movie_camera: au nombre de 2,5 millions en 1955, les agriculteurs :france: ne sont plus que 500 000 aujourd’hui. pourquoi leur nombre a-t-il été divisé par 5 en 70 ans ? :right_arrow: concurrence déloyale et asphyxie législative sont les principales raisons du mouvement agriculteursencolère.",Nation,6549
"l'accord de l'ue sur les importations agricoles d'ukraine continue de mettre nos agriculteurs en péril. le blé et l'orge restent sans protection, une nouvelle preuve que nos intérêts nationaux passent après les accords commerciaux européens.",Nation,6552
"la crise agricole est avant tout un sujet européen. le premier ministre dit qu’il place l’agriculture au-dessus de tout. au-dessus de bruxelles aussi? a suivre, dès 8h10 lagrandeitw invité:",Nation,6571
ce samedi on a vu un président en sécession de son peuple au salon de l’agriculture. il a peur des agriculteurs car il sait qu’il les trahit sur l’autel de l’idéologie libérale et des traités de libre-échange européens ! hdpros2,Nation,6654
":sparkles:les fêtent leurs 100 ans ! :sheaf_of_rice: :cow: :grapes: parce qu’elles contribuent à l'avenir de l'agriculture française et parce que je soutiens les agriculteurs, je suis présente à l’événement organisé par la chambre d’agriculture de la nouvelle-aquitaine et la !",Nation,6674
"nouvelle-calédonie: émeutes sociales, politiques ou raciales ? l'analyse de frederic de natal",Nation,6677
« voir au salondelagriculture des crs qui n'avaient pas envie d'être là s'en prendre à des agriculteurs qui sont des gens pacifiques et civilisés était choquant. cela participe à l'agribashing que les écolos radicaux dirigés par pascal canfin impulsent à bruxelles.»,Nation,6735
"le vote de la loi d’orientation agricole laisse les agriculteurs face à leur détresse : pas de remise en cause de la concurrence déloyale, de l’ivresse normative, pas de prix rémunérateurs garantis. la macronie a tourné le dos à un monde agricole qui joue sa survie.",Nation,6768
:microphone: « c’est l’administration qui doit être au service des agriculteurs. et non l’inverse ! » ploa,Nation,6831
"la pêche illégale représente environ 11 à 26 millions de tonnes de la pêche annuelle mondiale lamya essemlali, présidente de sea shepherd france :""l'adn de shepherd c'est l'intervention, pas juste protester. c'est dramatique qu'on parle peu de la pêche illégale.",Nation,6871
"« la pac c’est pour la france 9 milliards d’euros, ce sont plusieurs millions de bénéficiaires ». emmanuel macron sait-il qu’il reste moins de 400 000 agriculteurs. qui sont les autres millions de bénéficiaires ?",Nation,6879
rappel essentiel ; pourquoi un moratoire sur les arn est urgent et nécessaire,Nation,6896
"en cas de désastre, pourra surtout se dédouaner de toute responsabilité et reconnaître (enfin) l'inefficacité du gouvernement précédent. :clown_face:",Nation,6898
l’ue s’apprête à faire passer une nouvelle loi qui détruira ce qu’il reste de la pêche et de l’agriculture en europe… l’écologie sert d’argument à des extrémistes qui veulent détruire tout qui fonctionne chez nous !,Nation,6901
"«les 30 ans de l’adq: début, suite et fin». ma petite leçon d'histoire récente du nationalisme québécoise dans le jdm.",Nation,6908
"quand les agriculteursencolere dénoncent un système ""qui marche sur la tête"", leur juste diagnostic peut s'étendre à toute la politique, y compris migratoire. tout est à revoir, et le temps est venu.",Nation,6943
« l'agriculture française est l'une des plus écolo du monde ! cessons de taper sur nos agriculteurs qui prennent plus que soin des terres qu'ils cultivent et des animaux qu'ils élèvent. ils sont les gardiens de nos paysages et de notre patrimoine naturel.» blocusdeparis,Nation,6994
ce titre au québec mon ostie!,Nation,7016
"hayer dit le même gros mensonge que toutes les listes qui veulent rester dans l’ue et prétendent en même temps combattre le libre-échange : on va « mettre en place un bouclier ». le rn appelle ça « le juste-échange », d’autres (reconquête, lfi) « des protections », etc. merci…",Nation,7027
"quand on voit le tweet du ministre de l'agriculture tenter de contredire en reconnaissant fièrement que 50% de la viande bovine consommée en restauration collective en france est étrangère, c'est un aveu d'échec cuisant pour notre souveraineté alimentaire.",Nation,7118
pascal canfin en 4e position sur la liste renaissance. nos agriculteurs apprécieront ! europeennnes2024,Nation,7151
:yellow_circle: le guichet france service agriculture sera un outil de contrôle et de contrainte pour nos agriculteurs : :right_arrow: nouveau délai 5 ans pour notifier un départ en retraite. :right_arrow: obligation de conseil pour les candidats à l’installation sous peine de perdre les aides à l’installation.,Nation,7186
"salonagriculture2024 / le triptyque fondateur du marché commun, ""produire, protéger, exporter"", a été remplacé par un triptyque mortifère, ""consommer, ouvrir, importer"". il faut revenir au triptyque fondateur ! :red_circle:voir l'émission complète :",Nation,7187
":red_circle: manifestations : des syndicats vent-debout contre le rn :speaking_head: ""on a une consigne de vote très claire : ce sera ni le libéralisme de macron qui nous amène dans le mur, ni l'extrême droite"" -",Nation,7209
« on ne comprend rien à ce mouvement social si on ne comprend pas que nos agriculteurs jouent ici leur survie ! ils sont en train de crever alors qu'ils bossent comme des damnés ! c'est pour cela qu'on ne peut que les soutenir !» blocusdeparis rungis,Nation,7223
nouvelle-calédonie : « le racisme est l’outil politique des indépendantistes radicaux »,Nation,7255
":red_circle: manifestations : des syndicats vent-debout contre le rn :speaking_head: ""avec la reforme de l'assurance chômage et celle des retraites, ce sont des centaines de milliers de personnes qui vont se retrouver sans rien d'ici 2027"" -",Nation,7342
le cyclone belal vient de commencer à toucher laréunion. prions pour que les dégâts se résument à du matériel. toutes mes pensées accompagnent les réunionnais ce matin.,Nation,7351
":crescent_moon:tard dans la nuit, après des dizaines d’heures de débats, nous venons de finir l’étude du ploa. :clapping_hands_light_skin_tone:bravo à nos référents du texte, et , d’avoir défendu le programme agriculture de face à la déconnexion des macronistes et de la nupes !",Nation,7422
l’association “tous au verger” à votre service pour ramasser vos fruits à vitré !,Nation,7456
"l’agriculture française, c’est notre patrimoine et c’est notre identité, c’est la garante des goûts uniques de notre gastronomie. nos agriculteurs peuvent compter sur le rn pour les défendre face à la concurrence déloyale et à l’écologie punitive ! vivementle9juin",Nation,7462
"« ce qui mine le plus les agriculteurs est bien la piteuse image que l’on véhicule d’eux. non, ce ne sont pas de vieilles brutes incultes qui abîment la nature mais des gens de plus en plus diplômés qui prennent soin des terres sur lesquelles ils travaillent.»",Nation,7483
"la dimension raciale des émeutes de nouvelle-calédonie est passée sous silence. qui tue-t-on? des blancs, et pour ce qu’ils sont. et cette minorité là bien sûr, personne à gauche ne veut la défendre.",Nation,7533
:fire: nous exprimons notre soutien total aux agriculteurs en révolte. + d’argent pour les agriculteurs qui nourrissent la france :tractor: - pour financer l’immigration massive qui la tue,Nation,7551
"l’agriculture française est dans une situation de grande souffrance, notamment face à la concurrence déloyale. or elle est une part de notre identité. si nous laissons faire la commission européenne avec son green deal, notre agriculture disparaitra ! vaucluse",Nation,7558
"[l’invité] « sans paysans, la campagne française ne sera plus la même » :down_arrow:",Nation,7592
"le gouvernement vit dans un monde parallèle ! ce n’est pas en recréant un nouveau guichet d’installation que nous allons inciter les jeunes à devenir agriculteurs, mais en cessant de leur imposer le pacte vert et les traités de libre-échange !",Nation,7619
":red_circle: union nationale : ""une première étape du rassemblement"", espère charles millon :fountain_pen: l'ancien ministre de la défense de jacques chirac a mis en place un soutien logistique à destination des candidats de droite:down_arrow:",Nation,7639
nouveau front populaire : de poutou à hollande ! - par philippe kerlouan nouveaufrontpopulaire faut-il rappeler le communiqué du npa au lendemain de l'attaque terroriste du hamas ?,Nation,7663
":honeybee: les apiculteurs lot-et-garonnais se joignent aux agriculteursencolère. comme ces derniers, ils subissent une concurrence déloyale imposée par l’ue qui favorise l’importation de miel à bas prix et de qualité nettement inférieure provenant de l’autre bout du monde. soutien",Nation,7743
":writing_hand_medium-light_skin_tone: alors que 30 communes du lot-et-garonne qui ont été particulièrement touchées par la sécheresse de l’été 2022 n’ont pas obtenu la reconnaissance de l’état de catastrophe naturelle, je demande au ministre de l’économie d’expliquer les critères qui justifient cette décision.",Nation,7844
il ne faut rien attendre de ceux qui ont mis la france dans cet état. les agriculteurs menacent de reprendre leur mouvement. le volontarisme d' attal sur l’ecole n’aura duré que quelques jours. l'annonce de la suppression du droitdusol à mayotte relève de la même poudre aux…,Nation,7961
la noyade --- démographie | le québec franchit la barre des 9 millions d’habitants via,Nation,7966
:blue_circle: « on marche sur la tête » c’est ce qu’essaient de faire entendre au gouvernement les agriculteurs de tout le pays.:tractor: pas de pays sans paysans ! soutien aux agriculteurs en révolte:fire:,Nation,8025
le traité de libre échange avec la nouvelle zélande qui vient d’être signé à l’ue est un énième clou enfoncé dans le cercueil de l’agriculture et de l’industrie française. l’ue n’est-elle bonne qu’à servir les intérêts des pays extérieurs à ses frontières ?…,Nation,8028
"qu'est-ce que le ministre de l'agriculture n'a pas compris dans les revendications des agriculteurs ? ils réclamaient des prix rémunérateurs, la fin des surtranspositions et des traités de libre-échange, mais dans sa loi d'orientation agricole, il ne leur apporte rien !",Nation,8032
"le compte n’y est pas pour nos agriculteurs, qui continueront de subir de plein fouet la concurrence déloyale des produits agricoles ukrainiens. il faut en finir avec cette exemption tarifaire qui est en train de mettre à genoux nos filières agricoles !",Nation,8052
"le choix de la décroissance agricole est une faute économique et morale majeure. dans le temps incertain qui vient, la souveraineté alimentaire doit être une ambition prioritaire. je défends une grande loi ""mangeons français"" pour soutenir nos agriculteurs. legrandjury",Nation,8100
"les français sont prévenus : le prétendu front populaire qui s’allie avec le npa, l’extrême-gauche la plus violente, soutien du hamas et des émeutiers, entend accélérer l’effondrement des institutions et l’anarchie. les élections des 30 juin et 7 juillet doivent permettre de",Nation,8136
il y a trois urgences en nouvelle-calédonie : :backhand_index_pointing_right: rétablir l'ordre. c’est la force qui calme la violence et la faiblesse qui l’excite. :backhand_index_pointing_right: régler une fois pour toutes la question institutionnelle. :backhand_index_pointing_right: faire respecter nos intérêts géostratégiques et économiques sans aucune naïveté.,Nation,8243
le président de civitasinternational avec les paysans devant le parlement européen agriculteursencoleres paysansencolère rothschild a écouter,Nation,8264
"avec marie-luce brasier et , nous visitons cet après-midi la coopérative de la vanille de bras-panon. produit phare de l’île de la réunion, la vanille bourbon cultivée ici est l’une des meilleures au monde.",Nation,8288
"aujourd'hui, l'essentiel du bœuf consommé par nos enfants dans les cantines scolaires est d'origine importée : donnons une priorité aux agriculteurs dans les marchés publics !",Nation,8297
un bien joli gouvernement : il pique notre fric et nous envoie les flics les gouvernements macronistes se suivent et se ressemblent. quelqu’un a dit un jour qu’emmanuel voulait être le seul et l’unique soleil de la macronie. égalité et réconciliation,Nation,8332
"de réunion d’urgence en meeting de crise, de grands discours de la dernière chance en promesses d’annonces fortes, qu’est-ce qui a changé pour nos agriculteurs ? rien ! on n’efface pas des années d’erreurs en quelques jours de paroles. royan vivementle9juin",Nation,8339
"magnifique union des agriculteursencolère et des pêcheurs pour bloquer boulogne ce week-end ! (cf vidéo :right_arrow_curving_down:) la révolte paysanne est en train de reprendre un peu partout en france car les paysans voient bien que macron leur a menti, pareil pour attal, et que l’ue continue de…",Nation,8340
":rooster: la france importe 800 000 tonnes de poulet par an à bas coût, essentiellement du brésil, de thaïlande et d’ukraine. avec , mettons fin à la concurrence internationale déloyale. défendons le localisme et le patriotisme économique :france: ! dimanchejevotebardella",Nation,8362
immobilier. vers la reprise du marché dans les 5 départements bretons ?,Nation,8394
"une «crise humanitaire», une catastrophe pour le québec. ma chronique du jdm.",Nation,8438
"attention ! cocktail explosif. les agriculteursencolere portent une possible déflagration sociale. la révolte ne met pas seulement en cause la technocratie européenne. elle est aussi celle d’une france enracinée, en passe de disparaître sous le grandeffacement mondialiste.…",Nation,8470
[une prof en france] la réforme de la réforme : usine à gaz en perspective - par virginie fontcalel les parents vont avoir quelques surprises à la rentrée.,Nation,8472
"alors que l’etat doit choisir en juin un tracé pour son projet de ligne très haute tension reliant jonquières à fos-sur-mer, je recevais hier en mairie de beaucaire les représentants de rte avec et pour leur redire notre ferme opposition au projet.",Nation,8510
":sheaf_of_rice: s'est exprimé à propos de nos agriculteurs et de la manière dont ils sont traités au niveau européen :european_union: legrandoral c'est le 25 avril, billetterie ouverte :link: agriculteurs mercosur europeennes2024",Nation,8512
":red_circle: législatives : amal bentounsi, candidate du nouveau front populaire, accuse la police « d’assassiner » et défend les croyants homophobes :right_arrow_curving_down: nfp lfi politique",Nation,8513
":tractor: au salonagriculture2024 comme partout en france, les français n’ont qu’une chose à dire : « dehors escrocs libéraux ! » agriculteursencolere",Nation,8535
il faut ramener le calme en nouvelle-calédonie par l'intermédiaire de l'état d'urgence que j'ai réclamé. ce qui se passe est un véritable drame. il y a un risque de guerre civile et il faudra que tout le monde se mette autour de la table pour trouver ensemble un avenir.,Nation,8568
":check_mark_button::ballot_box_with_ballot: une fois n’est pas coutume, l’article 15 de la loiagricole apporte quelques améliorations concernant les procédures contentieuses sur les ouvrages hydrauliques agricoles : :right_arrow: procédure accélérée :right_arrow: sécurité juridique améliorée :right_arrow: accès au juge non restreint",Nation,8571
"pierre-yves rougeyron, politologue, expose la montée du rn à marseille : «le gouvernement ne peut s’en prendre qu’à lui-même», dans faceaface",Nation,8573
total soutien aux agriculteurs,Nation,8603
"«quand le conseil constitutionnel veut faire disparaître l’âme du palais-royal» par pour s’offrir une salle d’attente à l’utilité mystérieuse, le conseil constitutionnel s’apprête à détruire à l’oriental, la plus ancienne boutique encore en activité du…",Nation,8656
c'est en pleine nuit que nous obtenons une victoire lors de l'examen de la loi d'orientation agricole : le rejet de la financiarisation des terres agricoles que les macronistes voulaient mettre en place avec la création des gfai.,Nation,8727
"face aux guerres économiques qui nous sont menées, il faut sortir de la naïveté. on doit instaurer la réciprocité dans les accords commerciaux, défendre nos intérêts dans la mondialisation et instaurer une priorité française et européenne dans la commande publique.",Nation,8761
:tractor: nous proposons une réécriture générale de l’article 1 de la loa : :right_arrow: définition de la souveraineté et de la sécurité alimentaires. :right_arrow: fin des surtranspositions :right_arrow: contrôle des importations :right_arrow: information du consommateur :right_arrow: produits :france: dans la commande publique. directan,Nation,8798
"durant des décennies, au parlement européen, je me suis échiné avec d’autres, fn/rn ou étrangers, pour dire les normes agricoles excessives, la bureaucratie paralysante, les traités de libre-échange une concurrence déloyale, etc. en vain. hélas, là encore nous avions raison !",Nation,8855
":sheaf_of_rice: ecologie punitive, décroissance agricole, stigmatisation des agriculteurs… de la est l’ennemie de nos paysans ! le 9 juin, pour sauver l’agriculture, votez ! vivementle9juin !",Nation,8856
:red_circle: émeutes en nouvelle-calédonie : le projet de loi constitutionnelle à l’origine des violences suspendu :right_arrow_curving_down:,Nation,8882
":yellow_circle: sur le stand de la avec . tous sont unanimes, il faut un changement radical de politique agricole. sia2024",Nation,8891
"""les conditions de travail sont de plus en plus difficiles, avec des chantiers qui doivent être de plus en plus rapides"" alerte clara simay, architecte grandmatin",Nation,8921
"rdv midi midinews - colères des agriculteurs aux pêcheurs, un mot comme un trait d’union: la dépossession. que répondre à la france des dépossédés. - qu’incarne la france des agriculteurs et des pêcheurs? terre mer paysages - oqtf l’impuissance?",Nation,8946
":red_circle: un nouveau crépol ! des racailles venues « casser du blanc » ont affronté des agriculteurs, tuant presque l'un d'eux ! votez le 9 juin, diffusez cette info et anticipez la france de demain. la guerre civile ethno-culturelle est déjà là ! ma vidéo :",Nation,8947
"nouvelle-calédonie : un gendarme tué par un tir accidentel - par boulevard voltaire nouvellecalédonie émeutes ce mercredi 15 mai, gérald darmanin a annoncé la mise en place de l'état d'urgence en nouvelle-calédonie.",Nation,9039
"éric ciotti plaide pour un revenu net de 1500 euros pour les agriculteurs. n'importe quoi ! si même la droite sombre dans l'assistanat, on ne va pas s'en sortir ! les agriculteurs veulent qu'on les laisse bosser, pas qu'on en fasse des assistés !",Nation,9047
":movie_camera: à paris, un discours prônant la défense des agriculteurs et de la souveraineté alimentaire. à bruxelles, un discours libre-échangiste et mondialiste. j’interrogeais gabriel attal sur le double langage du gouvernement au sujet de sa politique agricole. qag :right_arrow_curving_down:",Nation,9086
":movie_camera: incapable de protéger nos productions nationales face aux accords de libre-échange, de revenir sur les surtranspositions et d’alléger la fiscalité agricole, le gouvernement a présenté un texte qui n’améliorera en rien la situation de nos agriculteurs français. directan :right_arrow_curving_down:",Nation,9100
le québec souffre d’obésité bureaucratique morbide. ma chonique du jdm.,Nation,9102
":red_apple::pear: aujourd’hui aux vergers de mataly à laffitesurlot, pour échanger avec daniel sauvaitre, directeur de l’association nationale pommes poires et gaël antoine, arboriculteur et dirigeant de cette exploitation qui produit 1 500 tonnes de pommes par an.",Nation,9149
"les députés lr affirment partager la vision agricole des macronistes : décroissance, traités de libre-échange, concurrence déloyale étrangère, surtranspositions contraignantes... c'est ça que vous défendez ? votre soumission à macron est flagrante !",Nation,9173
rappel : un traité international (de libre-échange par exemple) a une valeur juridique supérieure à la loi. i on apprend cela aux étudiants en droit dès le premier mois de cours. ces gens se moquent du monde.,Nation,9198
"2 heures du matin ! le texte sur la loi d’orientation agricole est terminé, le vote solennel aura lieu mardi prochain. directan",Nation,9250
a midi midinews spéciale agriculteurencolere - agriculteur: «siège» de paris et blindés: fallait-il en arriver là? - europe normes la faute à bruxelles? vonderleyen - agriculture notre souveraineté alimentaire menacée? - ukraine poulet une concurrence déloyale assumée?,Nation,9253
"l’union européenne prône une politique de décroissance. avec le pacte vert, elle ambitionne de réduire les surfaces agricoles. leur idéologie est simple : tout ce que fait le homme est toxique. il faut donc réduire l’activité de l’homme, et l’agriculture en fait partie.",Nation,9267
":check_mark_button: oui, à la préservation des haies ! :cross_mark: non, au totalitarisme de l’administration ! les agriculteurs demandent de la souplesse, de la confiance et du bon sens ! ploa",Nation,9275
peut-être a t’il enfin compris que nos agriculteurs veulent des actes et n’ont pas à servir de béquille à sa promotion.,Nation,9286
"[entretien] nouvelle-calédonie : « veut-on renoncer à être une grande puissance ? » - par gabriel decroix la chine s’est déjà emparée de tout l’arc mélanésien, les fidji, le vanuatu, la micronésie. reste la nouvelle-calédonie.",Nation,9303
:red_circle: propos honteux de pascal lavergne en hémicycle qui se permet de se moquer ouvertement des membres de la . les agriculteurs lot-et-garonnais se souviendront de ce mépris de classe… et moi aussi ! directan,Nation,9318
"ivgconstitution / j’ai eu de nombreuses discussions, amicales et franches, avec simone veil. si elle était là, elle ne serait pas d'accord et je vais vous expliquer pourquoi. elle m’a dit deux choses : 1/ ""relisez ma loi, philippe, l’article 1 garantit le respect de tout être",Nation,9364
:strawberry::grapes:toujours au plus près des lot-et-garonnais : aujourd’hui avec des agriculteurs et vignerons afin d’échanger sur leurs problématiques notamment la concurrence déloyale ou encore l’absence de propositions du gouvernement suite à l’arrachage des vignes dû au mildiou.,Nation,9367
":red_circle: gabriel attal vient d'annoncer 10 mesures, mais aucune ne s'attaque au fond du problème : la concurrence déloyale créée par le libre-échange mondialisé si cher à ses alliés européens. agriculteursencolère",Nation,9379
attention à ce que vous écrivez. philippe de villiers n’a jamais été membre du rpr. il fut membre de l’udf mais en est parti très vite... ( vérifier avant d’écrire ),Nation,9391
"les comores mènent à mayotte une guerre démographique. le problème, c'est qu'ils mènent cette guerre avec la complicité de nos dirigeants !",Nation,9425
"à quelques jours des élections européennes, des agriculteurs français et espagnols bloquent la frontière à biriatou (pyrénées-atlantiques) : si vous croyez, gouvernants, qu'on peut se payer les paysans sans le payer un jour, vous rêvez, c'est pas fini !",Nation,9478
une folie ! l'élargissement sans fin de l'ue à l'ukraine et à la moldavie ne fera que favoriser l'appauvrissement de nos agriculteurs et la perte de compétitivité de notre industrie. les français vont devoir débourser des dizaines de mds€ pour pallier ces adhésions !,Nation,9500
":writing_hand_medium-light_skin_tone: interpellée lors de mes différentes visites chez les producteurs lot-et-garonnais de tomates:tomato: au sujet de la concurrence déloyale qu’ils subissent, je demande au ministre de l’agriculture de supprimer la réduction de droits de douane des produits exportés en saison estivale.",Nation,9547
":classical_building::france: dans quelques minutes, retrouvez ma question au ministre de l’agriculture concernant la grippeaviaire. :right_arrow:",Nation,9549
"au sia, le duo macron/attal s’engageait à défendre les agriculteurs contre les effets nocifs des traités de libre-échange. aujourd’hui, leurs députés européens ont voté le nouvel accord avec le chili. ainsi va la macronie, de reniement en mensonge, de revirement en trahison.",Nation,9578
