:sheaf_of_rice: :man_farmer_light_skin_tone: toujours aux côtés des agriculteursencolère à agen avec : de nombreux échanges autour de leurs difficultés quotidiennes que je continuerai à faire remonter à l’assemblée nationale. on vous soutient ! lotetgaronne,Nation,9584
":fishing_pole: surtransposition des normes européennes, harcèlement administratif, concurrence étrangère, fanatisme vert : complètement asphyxiés, les pêcheurs du grau-du-roi se battent pour leur survie. à bruxelles, les élus les défendront !",Nation,9627
"la nouvellecalédonie est en état de guerre. l’état ne doit pas reculer : après trois référendums, il est hors de question de laisser la violence l’emporter sur la démocratie. le gouvernement doit déclencher immédiatement l’état d’urgence pour rétablir l’ordre et la sécurité.",Nation,9632
"vous dites qu'une défaite du camp du oui va affaiblir le québec, ce qui est vrai, mais vous allez voter non pour provoquer cette défaite, ce qui est absurde.",Nation,9654
"c’est la même personne qui a ""protégé"" les agriculteurs français…:clown_face: avec des protecteurs comme ça, pas besoin de prédateurs. canfin agriculteursencolère",Nation,9657
":red_circle: les désaccords au sein du frontpopulaire concernent également la position à adopter vis-à-vis du massacre du 7 octobre ainsi que le sort d'adrien quatennens, condamné pour violences conjugales. :right_arrow_curving_down:",Nation,9660
"à saintebazeille aujourd’hui pour l’inauguration de la 39e foire à la fraise :strawberry:, aux fleurs :cherry_blossom: et au vin :wine_glass:. une très bel événement qui met à l’honneur notre patrimoine lot-et-garonnais agricole, culinaire et artisanal !",Nation,9663
"philippe poutou (npa) : ""on veut la personne la plus radicale possible pour incarner le frontpopulaire (…) nous sommes plus proches des mélenchon, ruffin""",Nation,9688
:yellow_circle: ce soir à boé aux côtés des agriculteurs lot-et-garonnais à l’occasion de l’assemblée générale de la .,Nation,9716
"le foncier agricole :france: est surtaxé par rapport aux autres pays :european_union: : taxe foncière sur les propriétés non bâties, impôt sur la fortune immobilière, taux d’exonération insuffisant. :right_arrow:adaptons notre fiscalité afin de donner la possibilité à nos agriculteurs de vivre de leur métier.",Nation,9741
"la candidate macroniste se félicite d'avoir voté le pacte vert. mais quels sont les résultats du pacte vert ? des milliers d'agriculteurs en colère, descendus dans les rues parce qu'ils n'arrivent plus à travailler et à vivre de leurs efforts ! montbéliard",Nation,9812
"le changement climatique impose de nouveaux défis à nos producteurs et à nos agriculteurs. ici, à la réunion, les producteurs de vanille sont en train de s’adapter par la mise en place d’autres modes de production. les filières impactées doivent être aidées et accompagnées.",Nation,9815
a midi midinews - bruxelles le parlement encerclé colereagriculteurs - paris cap sur l’assemblée nationale? - attal de nouvelles mesures annoncées à midi - colere la stratégie de l’essoufflement par le gvt? - christophe guilluy et la france des dépossédés,Nation,9816